{
    "name": "Prismatic Spray",
    "description": "Eight multicolored rays of light flash from your hand. Each ray is a different color and has a different power and purpose. Each creature in a 60-foot cone must make a Dexterity saving throw. For each target, roll a d8 to determine which color ray affects it.",
    "level": 7,
    "casting_time": {
        "amount": 1,
        "unit": "action"
    },
    "target": {
        "targeting": "self",
        "zone": {
            "type": "cone",
            "size": 60
        }
    },
    "components": [
        "verbal",
        "somatic"
    ],
    "duration": {
        "duration": "instantaneous"
    },
    "school": "evocation",
    "classes": [
        "sorcerer",
        "wizard",
        "bard"
    ],
    "roll_table": {
        "dice": 8,
        "entries": [
            {
                "roll": 1,
                "result": "Red",
                "effects": [
                    {
                        "attack_save": {
                            "ability": "dexterity",
                            "failure": [
                                {
                                    "damage": {
                                        "type": "fire",
                                        "roll": {
                                            "dice": 6,
                                            "count": 10
                                        }
                                    }
                                }
                            ],
                            "success": [
                                {
                                    "damage": {
                                        "type": "fire",
                                        "roll": {
                                            "dice": 6,
                                            "count": 10
                                        }
                                    },
                                    "description": "(Halved)"
                                }
                            ]
                        }
                    }
                ]
            },
            {
                "roll": 2,
                "result": "Orange",
                "effects": [
                    {
                        "attack_save": {
                            "ability": "dexterity",
                            "failure": [
                                {
                                    "damage": {
                                        "type": "acid",
                                        "roll": {
                                            "dice": 6,
                                            "count": 10
                                        }
                                    }
                                }
                            ],
                            "success": [
                                {
                                    "damage": {
                                        "type": "acid",
                                        "roll": {
                                            "dice": 6,
                                            "count": 10
                                        }
                                    },
                                    "description": "(Halved)"
                                }
                            ]
                        }
                    }
                ]
            },
            {
                "roll": 3,
                "result": "Yellow",
                "effects": [
                    {
                        "attack_save": {
                            "ability": "dexterity",
                            "failure": [
                                {
                                    "damage": {
                                        "type": "lightning",
                                        "roll": {
                                            "dice": 6,
                                            "count": 10
                                        }
                                    }
                                }
                            ],
                            "success": [
                                {
                                    "damage": {
                                        "type": "lightning",
                                        "roll": {
                                            "dice": 6,
                                            "count": 10
                                        }
                                    },
                                    "description": "(Halved)"
                                }
                            ]
                        }
                    }
                ]
            },
            {
                "roll": 4,
                "result": "Green",
                "effects": [
                    {
                        "attack_save": {
                            "ability": "dexterity",
                            "failure": [
                                {
                                    "damage": {
                                        "type": "poison",
                                        "roll": {
                                            "dice": 6,
                                            "count": 10
                                        }
                                    }
                                }
                            ],
                            "success": [
                                {
                                    "damage": {
                                        "type": "poison",
                                        "roll": {
                                            "dice": 6,
                                            "count": 10
                                        }
                                    },
                                    "description": "(Halved)"
                                }
                            ]
                        }
                    }
                ]
            },
            {
                "roll": 5,
                "result": "Blue",
                "effects": [
                    {
                        "attack_save": {
                            "ability": "dexterity",
                            "failure": [
                                {
                                    "damage": {
                                        "type": "cold",
                                        "roll": {
                                            "dice": 6,
                                            "count": 10
                                        }
                                    }
                                }
                            ],
                            "success": [
                                {
                                    "damage": {
                                        "type": "cold",
                                        "roll": {
                                            "dice": 6,
                                            "count": 10
                                        }
                                    },
                                    "description": "(Halved)"
                                }
                            ]
                        }
                    }
                ]
            },
            {
                "roll": 6,
                "result": "Indigo",
                "effects": [
                    {
                        "attack_save": {
                            "ability": "dexterity",
                            "failure": [
                                {
                                    "condition": "restrained"
                                },
                                {
                                    "description": "The target must make a Constitution saving throw at the end of each of its turns. If it successfully saves three times, the spell ends. If it fails its save three times, it permanently turns to stone and is subjected to the petrified condition. The successes and failures don't need to be consecutive."
                                }
                            ]
                        }
                    }
                ]
            },
            {
                "roll": 7,
                "result": "Violet",
                "effects": [
                    {
                        "attack_save": {
                            "ability": "dexterity",
                            "failure": [
                                {
                                    "condition": "blinded"
                                },
                                {
                                    "description": "The target must make a Wisdom saving throw at the start of your next turn. A successful save ends the blindness. If it fails that save, the creature is transported to another plane of existence of the DM's choosing and is no longer blinded."
                                }
                            ]
                        }
                    }
                ]
            },
            {
                "roll": 8,
                "result": "Special",
                "effects": [
                    {
                        "description": "The target is struck by two rays. Roll twice more, rerolling any 8."
                    }
                ]
            }
        ]
    },
    "source": {
        "text": "Player's Handbook p. 267"
    }
}